{
  "decision_id": "20260425_cloud_dance",
  "product_id": "cloud_dance",
  "mode": "standard",
  "creative_freedom": 0.15,
  "family": "F02",
  "rationale": "F02 Full-Color Poster escolhida por compatibilidade ideal com o produto e mood evening_riverside. Cloud Dance é sofisticado, ethereal, cream-foam delicate — pede composição editorial-premium com hero isolado sobre fundo flat ou subtly warm. F02 permite hero respirar e tipografia dominar bottom-third. Mood evening_riverside alinha com visual_dna warm-amber + cocoa-brown.",
  "url_params": {
    "hero": "<HERO_URL>",
    "logo": "assets/logo.png",
    "selo": "assets/selos/ritual_so_rio-creme.png",
    "title": "Cloud|Dance",
    "info_top": "Vodka Pera · Bianco · Baunilha",
    "accent": "Calmo, dourado, nosso.",
    "info_bottom": "Valada do Ribatejo · sorio.pt",
    "display_size": 140,
    "accent_size": 46,
    "overlay_strength": 1.1,
    "hero_position": "center 55%",
    "show_logo": 1,
    "show_selo": 1,
    "show_accent": 1,
    "show_hairline": 1,
    "show_wave": 1,
    "show_info_top": 1,
    "show_info_bottom": 1
  },
  "designer_brief": {
    "subject": "Coupe glass cocktail with silky egg white foam top, single pear slice on rim",
    "ingredients_visible": [
      "pear slice on rim",
      "egg white foam crown"
    ],
    "ingredients_outside": [
      "vanilla pod leaning against glass base",
      "pear peel ribbon spiral on deck",
      "cocoa-sugar dust particles scattered"
    ],
    "warning_never_inside": [
      "mint",
      "thyme",
      "rosemary",
      "cinnamon stick"
    ],
    "lighting": "warm directional from upper-right, dramatic chiaroscuro, golden hour spill on cream foam",
    "background": "flat cocoa-brown (#6B4A2D Madeira Queimada) or warm-amber gradient subtle, motion-friendly per FAM-F03-01 logic adapted",
    "subject_position": "center lower-third (hero_position center 55%)",
    "color_palette_keywords": [
      "cocoa-brown",
      "cream-white-foam",
      "pear-yellow-green",
      "vanilla-dark",
      "warm-amber"
    ],
    "object_sheet_url": "object_sheet.png",
    "negative_prompt": "no mint, no thyme, no rosemary, no cinnamon stick inside glass, no high saturation neon, no abstract shapes, no textured wood deck (keep flat bg), no busy patterns competing with hero"
  },
  "inspired_by": [
    "ref_024_mojito_olive_minimal_classic",
    "ref_026_negroni_burgundy_serif_display",
    "ref_028_cocktails_split_stone_peach"
  ],
  "principles_applied": [
    "UNI-01",
    "UNI-03",
    "UNI-04",
    "TYPO-01",
    "TYPO-02",
    "TYPO-03",
    "COLOR-01",
    "COLOR-02",
    "COLOR-03",
    "COMP-01",
    "COMP-03",
    "LEG-01",
    "FAM-F02-01",
    "ANTI-01"
  ],
  "principles_relaxed": [],
  "experimentation_log": null,
  "vision_critique_brief": "F02 evening_riverside Cloud Dance. Coupe glass com egg white foam delicado, pear slice no rim. Verificar: garnish nunca dentro do copo (warning mint/thyme/rosemary/cinnamon do produto), tipografia 3 camadas Blueprint (Display off-white 140px · Accent dourado italic 46px · Info tracked caps), contraste WCAG AA off-white sobre overlay cocoa-brown, hero subject lower-third (center 55%), selo Ritual Só Rio creme (não dourado — hero tem warm-amber dominante, creme traz warmth contraste per COLOR-02), overlay_strength 1.1 (hero bottom médio per COLOR-01), fundo flat cocoa-brown ou warm-amber gradient sem textura wood deck (motion-friendly per adaptação FAM-F03-01). Cloud Dance precisa de respirar — restraint total.",
  "human_review_required": false
}